"facebookUrl","text","date","likesCount","commentsCount","isRecommended"
"https://www.facebook.com/hoaloprisonrelic/?locale=vi_VN","tôi yêu Hỏa Lò ko nói nhiều","2025-10-24T17:45:13.000Z","2","0","true"
"https://www.facebook.com/hoaloprisonrelic/?locale=vi_VN","""Biến nhà tù thành trường học""

Để lịch sử không chỉ nằm trong sách, 
mỗi lần quay lại phải dắt theo vài tâm hồn trẻ tuổi 🇻🇳. 
em đã nhiều lần tới đây và cảm thấy dc sự nhiệt tình của các bạn nhân viên, lễ phép, lịch sự. đặc biệt các chú bảo vệ rát đáng yêu ạ, lấy khăn che yên xe cho mn. Khá nhiều khách du lich nước ngoài tìm hiểu và di Hoả Lò . tuyetvoivocung. Yêu🇻🇳","2025-06-18T21:59:03.000Z","3","0","true"
"https://www.facebook.com/hoaloprisonrelic/?locale=vi_VN","Trải nghiệm quá tuyệt vời, service 10 điểm không có nhưng. Các câu chuyện lịch sử quá đỗi chân thực và xúc động. Chắc chắn sẽ quay lại nhiều lần cùng người thân","2025-04-22T01:48:50.000Z","0","0","true"
"https://www.facebook.com/hoaloprisonrelic/?locale=vi_VN","Địa điểm nhất định phải đi một lần trong đời.

Trân trọng đội ngũ quản lý và vận hành Di tích Nhà tù Hỏa Lò - Hoa Lo Prison Relic , đặc biệt trân trọng những người trẻ đang cố gắng làm sinh động lịch sử Việt Nam hào hùng. 

Mong mỗi người chúng ta, đều sống biết ơn và giàu lòng yêu nước.","2025-01-18T02:36:38.000Z","0","0","true"
"https://www.facebook.com/hoaloprisonrelic/?locale=vi_VN","Nên đi Tù, í lộn, Nhà tù Hỏa Lò nhiều hơn 01 lần khi bạn có dịp. Ngoài nội dung và các giá trị lịch sử lưu trữ thì các cô, chú/anh, chị nhân viên ở đây đều rất dễ thương.
Hôm rồi đi về mình bỏ quên máy ảnh ngoài hàng ghế gửi xe, khi phát hiện  trở lại thì thật may là các chú đã nhặt và cất vào trong tủ quản lý. Thủ tục nhận lại cũng rất nhanh. 10 điểm không nhưng ^^","2025-01-13T02:50:10.000Z","0","0","true"
"https://www.facebook.com/hoaloprisonrelic/?locale=vi_VN","Đội ngũ nhân viên rất tuyệt, từ các chú bảo vệ trông xe đến các bạn bán vé, hướng dẫn tham quan bên trong.
nếu có thể hãy đi vào ngày thường. Dịp Quốc Khánh, quốc tế Lao động… thì xếp hàng đi tù khá vất vả và toàn người là người.","2024-09-03T14:45:16.000Z","2","0","true"
"https://www.facebook.com/hoaloprisonrelic/?locale=vi_VN","Content page này siêu hài, siêu hay 😂😂","2024-08-29T10:29:35.000Z","0","0","true"
"https://www.facebook.com/hoaloprisonrelic/?locale=vi_VN","Great experience. Highly recommend.","2024-06-01T14:01:15.000Z","1","0","true"
"https://www.facebook.com/hoaloprisonrelic/?locale=vi_VN","Nên đi, nên đi, nên đi!
Điều quan trọng phải nói ba lần.
Đi để mà tri ân, biết ơn những anh hùng đã nằm xuống cho chúng ta có được ngày hôm nay.
Thực sự đã cố gắng kìm nén từ lúc vào cổng, nghẹn ngào khi chứng kiến tận mắt máy chém, nhưng tới khi đọc được những bức thư nhà của các chiến sĩ thì không thể nào nhịn được nữa, bật khóc tại chỗ.","2024-05-07T05:36:18.000Z","1","0","true"
"https://www.facebook.com/hoaloprisonrelic/?locale=vi_VN","Tour đêm Hoả Lò thực sự hấp dẫn!","2024-04-16T07:29:57.000Z","2","0","true"
"https://www.facebook.com/hoaloprisonrelic/?locale=vi_VN","Chưa có dịp tham gia Đêm Thiêng Liêng, rất mong sẽ được ghé lại 🤍","2023-12-29T06:09:56.000Z","1","0","true"
"https://www.facebook.com/hoaloprisonrelic/?locale=vi_VN","Rất tuyệt vời ! Tôi sẽ giới thiệu bạn bè","2023-10-20T15:16:17.000Z","2","1","true"
"https://www.facebook.com/hoaloprisonrelic/?locale=vi_VN","Nên đi để thấy yêu nước hơn","2023-10-14T07:03:04.000Z","1","0","true"
"https://www.facebook.com/hoaloprisonrelic/?locale=vi_VN","The exciting show and interesting performance","2023-08-05T02:21:15.000Z","1","2","true"
"https://www.facebook.com/hoaloprisonrelic/?locale=vi_VN","page đẹp quá. 
tin tức hữu ích","2023-07-23T07:35:50.000Z","1","0","true"
"https://www.facebook.com/hoaloprisonrelic/?locale=vi_VN","Mình đã có 1 buổi trải nghiệm thăm quan khu di tích với máy thuyết minh tự động. Mình xin phép chia sẻ một chút cảm nhận của mình. 
Về phần nhìn, mình thấy các địa điểm không gian tuy chỉ còn 1 phần nhưng rất ấn tượng. Tuy nhiên về phần nghe, mình phải thú thật, với cá nhân mình, mình không đọng lại cảm xúc gì cả, mọi thứ chỉ là thuyết minh từng điểm dừng cảm giác bị rời rạc và không có 1 “câu chuyện”. Việc phần thuyết minh không tạo được đường dẫn, khiến cảm xúc người nghe ít ấn tượng hơn phần nhìn rất nhiều.
Mình từng ghé thăm nhà tù S21 tại Campuchia. Khi bước ra, mình thật sự xúc động và nhớ mãi, dù cảnh quan và bài trí phần nhìn của S21 rất đơn sơ. Nhưng mình nghĩ vì phần nghe quá tốt, nên ngoài cung cấp thông tin hiểu biết cho người thăm quan, địa điểm này còn khiến người thăm quan trải nghiệm cảm xúc về 1 giai đoạn  lịch sử rất rõ ràng. Đó là điều với cá nhân mình còn chưa cảm nhận được khi ghé thăm nhà tù Hoả Lò. 
Rất mong di tích ngoài việc truyền đạt thông tin lịch sử, còn khiến mọi người ghé thăm phải trải qua được những cảm giác, cảm xúc của những người từng ở đây, của thân nhân những tù nhân từng ở đây thì chắc hẳn là sẽ vẹn tròn. Mình nghĩ nhà tù Hoả Lò còn thiếu một “câu chuyện”.
Xin bổ sung chút ít: dù không gửi xe nhưng mình thấy các xe máy gửi ở đây đều được che khăn phần yên. Rất tuyệt luôn ạ 😍😍","2023-07-08T03:37:08.000Z","3","1","true"
"https://www.facebook.com/hoaloprisonrelic/?locale=vi_VN","Trải nghiệm rất đáng nhớ và sẽ đi thêm nhiều lần nữa trong tương lai🥰","2023-06-15T16:06:23.000Z","0","1","true"
"https://www.facebook.com/hoaloprisonrelic/?locale=vi_VN","Trải nghiệm tuyệt vời, sẽ đi lại nhìu lần nữa.","2023-05-11T15:47:27.000Z","1","1","true"
"https://www.facebook.com/hoaloprisonrelic/?locale=vi_VN","Điểm tham quan rất ấn tượng, đáng để trải nghiệm.  Còn fanpage FB thì chất khỏi bàn ạ!!!","2023-05-11T15:44:30.000Z","1","1","true"
"https://www.facebook.com/hoaloprisonrelic/?locale=vi_VN","Điểm thăm quan rất ấn tượng, nhưng khi đi xem hơi vội để kịp giờ trả tai nghe","2023-05-11T15:16:10.000Z","0","2","true"
"https://www.facebook.com/hoaloprisonrelic/?locale=vi_VN","There’s nothing to say. Feel it yourself 🫂","2023-03-25T11:16:24.000Z","0","0","true"
"https://www.facebook.com/hoaloprisonrelic/?locale=vi_VN","Tại nhà tù Hỏa Lò, khi mình thấy hai hình ảnh đối lập giữa lịch sử tàn khốc và thái bình hiện tại, mình gần như không kìm được nước mắt. Trong giây phút khi ngồi dưới gốc cây bàng nơi cửa cống ngầm, khi ánh nắng rọi qua tán lá, gió thổi xào xạc khiến tâm mình thư thái, mình nghe thấy giọng một cậu bé tầm 5 tuổi hỏi bà: ""bà ơi, đây là cái gì?"". Người bà nhìn vào bức tường khắc những người tù bị hành hạ, nhẹ nhàng giảng giải. Cậu bé ngây thơ chỉ vào cái chân, ""Bà ơi, đây là cái chân!"". Bên tai mình là tiếng thuyết minh những nhà cách mạng vượt ngục, trước mắt mình là hình ảnh những người khốn khổ trong tù, đối lập với đó là thế giới thái bình mà bà cháu ấy, và cả mình nữa đang sống. Đôi mắt mình trở nên cay cay. Mình càng cảm thấy biết ơn ông cha, những người hi sinh bảo vệ tổ quốc biết bao. Thêm nữa, cảm ơn đội ngũ di tích Nhà tù Hỏa Lò. Mình sẽ quay lại một lần nữa, để tri ân những vị anh hùng, và sống lại một thời hào hùng quả cảm của cha ông ❤","2023-02-13T15:48:52.000Z","6","2","false"
"https://www.facebook.com/hoaloprisonrelic/?locale=vi_VN","Thực sự xúc động và biết ơn khi đến đây, 35 đoạn ghi âm thuyết minh về nhà tù Hoả Lò rất truyền cảm và hùng hồn. 1 địa chỉ không thể bỏ qua khi đến Hà Nội","2023-02-02T10:34:18.000Z","3","2","true"
"https://www.facebook.com/hoaloprisonrelic/?locale=vi_VN","Được chứng kiện lại những giai đoạn lịch sử , những người đã ngã xuống vì đất nước VN thật xúc động","2023-01-30T13:33:36.000Z","5","1","true"
"https://www.facebook.com/hoaloprisonrelic/?locale=vi_VN","Đầu năm đi tù, cả năm hòa bình, ấm no và tự do 😄","2023-01-24T13:17:08.000Z","1","0","true"
"https://www.facebook.com/hoaloprisonrelic/?locale=vi_VN","Mình thích máy nghe tự động thay vì Hdv giới thiệu như truyền thống. Nó khiến mình thoái mái và chủ động hơn khi đi tham quan. 
Mọi người đều vô cùng nhã nhận và lịch sự. Từ chú trông xe đến các bạn hướng dẫn. Chú trông xe còn vô cùng tinh tế khi để khăn ướt lên yên xe máy cho chúng mình vào ngày trời nắng nữa ạ.
1 điểm cộng nữa là wc khá sạch sẽ và thơm.
Vô cùng vô cùng nên đi nhé các bạn trẻ 👍👍👍","2023-01-14T10:27:39.000Z","2","2","true"
"https://www.facebook.com/hoaloprisonrelic/?locale=vi_VN","Đến đoạn máy chém, nghe thuyết minh xong khóc như mưa 😭 Xúc động và biết ơn vô vàn 🇻🇳🇻🇳🇻🇳","2022-11-19T12:18:24.000Z","2","0","true"
"https://www.facebook.com/hoaloprisonrelic/?locale=vi_VN","Một cảm xúc trào dâng hiểu hơn về lịch sử! Hiểu thêm những nỗi đau của ông cha... những con người vĩ đại viết nên lịch sử Việt Nam!
Bạn lớn nhà mình rất hào hứng và thích thú khi tìm hiểu về thông tin Di tích nhà tù Hoả Lò","2022-11-06T11:10:25.000Z","3","2","true"
"https://www.facebook.com/hoaloprisonrelic/?locale=vi_VN","While impressive there is little about what happened to the US servicemen and what they do show seems to be a bit tainted to make it look very comfortable and cushy. Either way worth the visit.","2022-10-25T13:36:16.000Z","2","1","false"
"https://www.facebook.com/hoaloprisonrelic/?locale=vi_VN","มาที่นี่เป็นครั้งที่สองแล้ว  ใครชอบศึกษาประวัติศาสตร์เวียดนาม แนะนำมาที่นี่เลย","2022-10-15T10:01:59.000Z","2","0","true"
"https://www.facebook.com/hoaloprisonrelic/?locale=vi_VN","Imppresive memorial regarding the struggle for independence of the Vietnamese people.","2022-10-14T07:43:22.000Z","1","0","true"
"https://www.facebook.com/hoaloprisonrelic/?locale=vi_VN","29/09/2022- chào Thu Hà Nội!

Sáng hôm qua mình đã ghé thăm Di tích, nơi gom góp những mảnh kí ức thời xưa để lại. Mình sợ và ấn tượng nhất chiếc máy chém đầu 🥹 quá dã man, quá rùng rợn!
Nếu như chọn địa điểm để đưa những người bạn đi chơi, mình sẽ chọn Di tích!
Cảm ơn tất cả Team của Di tích đã ân cần, tận tình với tất cả chúng mình ạ!","2022-09-30T05:31:35.000Z","2","1","true"
"https://www.facebook.com/hoaloprisonrelic/?locale=vi_VN","Mk sẽ quay lại Hoả Lò vào 1 ngày gần nhất, về cảnh quan thì k cần nói nhiều nữa r, điều mk khá ấn tượng là các bác và các ac ở đây siu nhiệt tình và thân thiện. Tặng Hoà Lò 1 tấm hình mk ms chụp đc^^","2022-09-15T02:57:53.000Z","2","1","true"
"https://www.facebook.com/hoaloprisonrelic/?locale=vi_VN","nể các bác thời xưa.chứ k như bây giờ toàn giang hồ mõm.xobg công an bắt ngồi khóc thấy bà 🤣🤣","2022-09-13T15:08:00.000Z","0","0","true"
"https://www.facebook.com/hoaloprisonrelic/?locale=vi_VN","This place shows me different feelings, make me cry and emotions under the sacrifice of historical heroes.","2022-09-10T13:38:42.000Z","3","1","true"
"https://www.facebook.com/hoaloprisonrelic/?locale=vi_VN","This place make me cry . I love Vietnam 🇻🇳.","2022-09-05T23:56:46.000Z","1","0","true"
"https://www.facebook.com/hoaloprisonrelic/?locale=vi_VN","Mình tới lần thứ 3, nơi đây thật nhiều cảm xúc. Máy thuyết minh thật tuyệt vời. Cám ơn sự chu đáo của ban quản lý thể hiện qua từng chi tiết nhỏ như khăn đệm trên yên xe máy ❤️❤️❤️","2022-09-04T07:58:13.000Z","2","2","true"
"https://www.facebook.com/hoaloprisonrelic/?locale=vi_VN","Tour xuất sắc, chuyên nghiệp, bạn dẫn truyện có giọng nói rất truyền cảm.","2022-09-02T15:23:59.000Z","1","1","true"
"https://www.facebook.com/hoaloprisonrelic/?locale=vi_VN","- Rất đáng để đi tham quan học hỏi","2022-08-28T06:43:33.000Z","2","1","true"
"https://www.facebook.com/hoaloprisonrelic/?locale=vi_VN","Rất thiêng liêng và ý nghĩa.🙏🙏🙏","2022-08-27T13:56:22.000Z","3","0","true"
"https://www.facebook.com/hoaloprisonrelic/?locale=vi_VN","Địa danh linh thiêng rất đáng trải nghiệm","2022-08-21T15:03:23.000Z","1","0","true"
"https://www.facebook.com/hoaloprisonrelic/?locale=vi_VN","Một đêm thiêng liêng vô giá - Đúng như tên gọi của hành trình!
Cảm ơn đât nước Anh hùng!
Sản sinh những lớp Anh hùng kiên trung!","2022-08-19T23:23:30.000Z","3","1","true"
"https://www.facebook.com/hoaloprisonrelic/?locale=vi_VN","Một nơi nên đi nếu tới Hà Nội, nơi bạn trải nghiệm chuyến đi du hành ngược thời gian. Tái hiện nhiều không gian lịch sử, dù tăm tối nhưng luôn hiện hữu ánh sáng. Mang lại nhiều cảm xúc thăng trầm cùng quật cường đầy bất khuất.","2022-08-14T11:21:03.000Z","2","1","true"
"https://www.facebook.com/hoaloprisonrelic/?locale=vi_VN","Parcours intéressant d'histoire, très complet, prendre l'autoguide où moult informations y sont données.","2022-08-04T10:27:41.000Z","2","1","true"
"https://www.facebook.com/hoaloprisonrelic/?locale=vi_VN","Tham quan Hoả Lò trc ngày lễ 27/7, thật quá xúc động khi được sống lại những phút giây quả cảm kiên cường gan dạ của cha ông thế hệ trước. Vô cùng biết ơn cha anh đã hi sinh cả tuổi thanh xuân, gia đình, máu xương... để chiến đấu vì tự do dân tộc. cám ơn BTV đã tái hiện sống động cs đầy gian khổ bi thương của các vị anh hùng dân tộc khi bị đày ải tra tấn nơi đây","2022-07-24T22:44:48.000Z","2","2","true"
"https://www.facebook.com/hoaloprisonrelic/?locale=vi_VN","Dân ta phải biết sử ta.
Một trong những nơi cho mình thật nhiều động lực sống.
Sống sao cho thật tử tế, xứng đáng với biết bao xương máu của những thế hệ ông cha đi trước để bảo vệ nền độc lập của Dân tộc mình!","2022-07-15T15:15:50.000Z","3","2","true"
"https://www.facebook.com/hoaloprisonrelic/?locale=vi_VN","Một trải nghiệm vô cùng ý nghĩa và đáng nhớ. Hãy đến để cảm nhận, để tự hào và biết ơn , để trân quý cuộc sống này hơn, để sống 1 cuộc đời có ý nghĩa hơn…","2022-07-02T18:06:42.000Z","2","1","true"
