"facebookUrl","text","date","likesCount","commentsCount","isRecommended"
"https://www.facebook.com/hoaloprisonrelic/?locale=vi_VN","Giữa những bộn bề của cuộc sống hãy giành thời gian đến tham quan Hoả Lò để được tự hào, được thực sự hướng tới một cuộc sống ý nghĩa hơn, tốt đẹp hơn!","2019-04-24T01:21:53.000Z","3","0","true"
"https://www.facebook.com/hoaloprisonrelic/?locale=vi_VN","A very meaningful place and such nice staffs <3
The guide, Mai Thu Huyen is more than awesome. Thank you so much.","2019-02-20T06:27:36.000Z","5","1","true"
"https://www.facebook.com/hoaloprisonrelic/?locale=vi_VN","Một địa điểm tham quan mang tính giáo dục cao, cho chúng ta thêm tự hào và khâm phục truyền thống yêu nước, bất khuất kiên trung của những người chiến sỹ cách mạng Việt Nam, nhớ về đạo lý “Uống nước nhớ nguồn”","2018-10-11T14:21:56.000Z","4","1","true"
"https://www.facebook.com/hoaloprisonrelic/?locale=vi_VN","Hiểu biết rõ quá khứ để tiến đến một tương lai tươi đẹp hơn. Đây là nơi thực hiện xuất sắc điều đó.","2018-10-11T09:12:04.000Z","3","1","true"
"https://www.facebook.com/hoaloprisonrelic/?locale=vi_VN",,"2018-10-11T08:38:25.000Z","0","0","true"
"https://www.facebook.com/hoaloprisonrelic/?locale=vi_VN","Tui chuyên phân phối ngan vịt gà cho mọi nba hàng khách sạn 0169.689.6665....0169.699.8088","2018-01-18T04:48:22.000Z","0","0","true"
"https://www.facebook.com/hoaloprisonrelic/?locale=vi_VN","Một di tích lịch sử cách rất đáng đi ..giữa lòng Hà Nội","2017-08-28T03:13:06.000Z","0","0","true"
